{
  "Id": "develapp.postalcode-index",
  "Name": "PostalCode_Index",
  "Vendor": "DevelApp",
  "DisplayName": "PostalCode Index",
  "Version": "1.0.0",
  "MinotaurVersion": "*",
  "Description": "PostalCode_Index postal-code grammar for the Minotaur parser platform.",
  "License": "MIT",
  "Tags": [
    "postal-code",
    "minotaur"
  ],
  "MainFile": "PostalCode_Index.grammar",
  "Dependencies": [],
  "Documentation": "https://github.com/DevelApp-ai/Minotaur-Grammars",
  "Repository": "https://github.com/DevelApp-ai/Minotaur-Grammars",
  "Author": {
    "Username": "larsbuch",
    "FirstName": "Lars",
    "LastName": "Buch-Jepsen"
  },
  "PricingModel": "free"
}
