{
  "Id": "develapp.dutch",
  "Name": "Dutch",
  "Vendor": "DevelApp",
  "DisplayName": "Dutch",
  "Version": "1.0.0",
  "MinotaurVersion": "*",
  "Description": "Dutch natural-language grammar for the Minotaur parser platform.",
  "License": "MIT",
  "Tags": [
    "natural-language",
    "minotaur",
    "optional-download"
  ],
  "MainFile": "Dutch.grammar",
  "Dependencies": [],
  "Documentation": "https://github.com/DevelApp-ai/Minotaur-Grammars",
  "Repository": "https://github.com/DevelApp-ai/Minotaur-Grammars",
  "Author": {
    "Username": "larsbuch",
    "FirstName": "Lars",
    "LastName": "Buch-Jepsen"
  },
  "PricingModel": "free"
}
