{
  "Id": "develapp.extensionfile",
  "Name": "ExtensionFile",
  "Vendor": "DevelApp",
  "DisplayName": "ExtensionFile",
  "Version": "1.0.0",
  "MinotaurVersion": "1.5.1",
  "Description": "ExtensionFile grammar describing project and tooling file formats for the Minotaur platform.",
  "License": "MIT",
  "Tags": [
    "project-file",
    "minotaur"
  ],
  "MainFile": "ExtensionFile.grammar",
  "Dependencies": [],
  "Documentation": "",
  "Repository": "https://github.com/DevelApp-ai/Minotaur-Grammars",
  "Author": {
    "Username": "larsbuch",
    "FirstName": "Lars",
    "LastName": "Buch-Jepsen"
  },
  "PricingModel": "free"
}
