{
  "Id": "develapp.ukpostalcode",
  "Name": "UK_Postal_Code",
  "Vendor": "DevelApp",
  "DisplayName": "UK Postal Code",
  "Version": "1.0.0",
  "MinotaurVersion": "1.5.1",
  "Description": "UK Postal Code grammar for the Minotaur platform.",
  "License": "MIT",
  "Tags": [
    "postal-code",
    "postal-codes"
  ],
  "MainFile": "UK_Postal_Code.grammar",
  "Dependencies": [],
  "Documentation": "",
  "Repository": "https://github.com/DevelApp-ai/Minotaur-Grammars",
  "Author": {
    "Username": "larsbuch",
    "FirstName": "Lars",
    "LastName": "Buch-Jepsen"
  },
  "PricingModel": "free"
}
