{
  "Id": "develapp.test.stepparserdemo",
  "Name": "StepParserDemo Grammar",
  "Vendor": "DevelApp",
  "DisplayName": "StepParserDemo Grammar",
  "Version": "1.0.0",
  "MinotaurVersion": "*",
  "Description": "Demo grammars for the ENFAStepLexer.Demo StepParserDemo application.",
  "License": "MIT",
  "Tags": [
    "test-grammar",
    "minotaur",
    "enfa"
  ],
  "MainFile": "ExpressionGrammar.grammar",
  "Dependencies": [],
  "Documentation": "https://github.com/DevelApp-ai/Minotaur-Grammars",
  "Repository": "https://github.com/DevelApp-ai/Minotaur-Grammars",
  "Author": {
    "Username": "larsbuch",
    "FirstName": "Lars",
    "LastName": "Buch-Jepsen"
  },
  "PricingModel": "free"
}
