{
  "Id": "develapp.javascriptes2022",
  "Name": "JavaScriptES2022",
  "Vendor": "DevelApp",
  "DisplayName": "JavaScriptES2022",
  "Version": "1.0.0",
  "MinotaurVersion": "1.5.1",
  "Description": "JavaScriptES2022 grammar for the Minotaur compiler-compiler platform. Authored and maintained by DevelApp.",
  "License": "MIT",
  "Tags": [
    "programming-language",
    "programming-languages",
    "minotaur"
  ],
  "MainFile": "JavaScriptES2022.grammar",
  "Dependencies": [],
  "Documentation": "README.md",
  "Repository": "https://github.com/DevelApp-ai/Minotaur-Grammars",
  "Author": {
    "Username": "larsbuch",
    "FirstName": "Lars",
    "LastName": "Buch-Jepsen"
  },
  "PricingModel": "free"
}
