{
  "Id": "develapp.croatian",
  "Name": "Croatian",
  "Vendor": "DevelApp",
  "DisplayName": "Croatian",
  "Version": "1.0.0",
  "MinotaurVersion": "1.5.1",
  "Description": "Croatian natural-language grammar for the Minotaur platform. Optional downloadable content, useful for multilingual parsing demos and testing the grammar format.",
  "License": "MIT",
  "Tags": [
    "natural-language",
    "natural-languages",
    "optional-content"
  ],
  "MainFile": "Croatian.grammar",
  "Dependencies": [],
  "Documentation": "README.md",
  "Repository": "https://github.com/DevelApp-ai/Minotaur-Grammars",
  "Author": {
    "Username": "larsbuch",
    "FirstName": "Lars",
    "LastName": "Buch-Jepsen"
  },
  "PricingModel": "free"
}
